question,query_entities,flat_backend,flat_answer,graphrag_answer,flat_score,graphrag_score,flat_hallucination,graphrag_hallucination,verdict,top_graph_edges
How did Polestar describe its strategic partners and major EV business risks?,Polestar,chromadb-tfidf,"Polestar mô tả các đối tác chiến lược là nền tảng của mô hình kinh doanh “asset-light”, chủ yếu dựa vào Volvo Cars và Geely cho sản xuất theo hợp đồng và chuỗi cung ứng; đồng thời công ty cũng phụ thuộc vào các đối tác/nhà cung cấp này để phát triển, cung ứng linh kiện, công nghệ, vật liệu và bảo đảm các cơ sở sản xuất mới vận hành đúng tiến độ, đúng công suất (2)(5). Rủi ro lớn của mảng EV mà Polestar nêu gồm: chậm trễ hoặc hạn chế công suất sản xuất/ramp-up làm ảnh hưởng doanh thu, dòng tiền và uy tín; đối tác hoặc nhà cung cấp chậm giao hàng, thiếu năng lực hoặc chất lượng không đạt khiến sản xuất và giao xe bị trì hoãn; dự báo sai nhu cầu dẫn đến dư thừa hoặc thiếu công suất/tồn kho, làm tăng chi phí, giảm biên lợi nhuận, gián đoạn sản xuất và chậm doanh thu; áp lực phải giảm giá để cạnh tranh khi thị trường EV dư cung; cùng với rủi ro thời gian giao vật liệu/linh kiện biến động và các sáng kiến cắt giảm chi phí khó thực hiện (1)(2)(3)(4)(5)","Polestar mô tả các đối tác chiến lược là nền tảng của mô hình kinh doanh “asset-light”, dựa chủ yếu vào thỏa thuận sản xuất theo hợp đồng và cung ứng với Volvo Cars và Geely; mô hình này theo Polestar cần ít vốn hơn để sản xuất xe và tạo doanh thu, đồng thời họ cũng phụ thuộc vào các đối tác này để vận hành nhà máy mới đúng tiến độ và đủ công suất (1)(2)(6). Rủi ro lớn của mảng EV mà Polestar nêu gồm: phụ thuộc vào đối tác/nhà cung cấp có thể gây dư thừa hoặc thiếu công suất, tồn kho và chi phí nếu dự báo nhu cầu sai; chậm trễ sản xuất, linh kiện, công nghệ và vật liệu; giao xe chậm; ảnh hưởng xấu đến biên lợi nhuận, doanh thu, dòng tiền, thương hiệu và thời điểm đạt lợi nhuận; áp lực phải giảm giá khi cung vượt cầu EV để cạnh tranh; và rủi ro thị trường nếu mẫu xe mới không được đón nhận như kỳ vọng (1)(3)(4)(5)(6)(7).",9,8,False,False,"FlatRAG: Cả hai câu trả lời đều bám sát bằng chứng và tổng hợp đúng các rủi ro chính quanh mô hình asset-light, phụ thuộc Volvo Cars/Geely, năng lực sản xuất, chuỗi cung ứng, dự báo nhu cầu và áp lực giảm giá. FlatRAG nhỉnh hơn vì trả lời trực tiếp hơn đúng trọng tâm “đối tác chiến lược được mô tả thế nào” và “rủi ro EV lớn”, không thêm ý ngoài trọng tâm. GraphRAG cũng đúng và có suy luận đa bước tốt, nhưng đưa thêm rủi ro mẫu xe mới không được thị trường đón nhận; ý này có trong bằng chứng nhưng hơi lệch khỏi trọng tâm đối tác chiến lược/rủi ro vận hành EV chính nên kém gọn hơn. Không thấy bịa đặt rõ ràng ở cả hai.",Polestar -[HAS_STRATEGIC_PARTNER]-> Volvo Cars | Polestar -[HAS_STRATEGIC_PARTNER]-> Geely | Polestar -[HAS_STRATEGIC_PARTNER]-> Xingji Meizu | Polestar -[RELIES_ON]-> strategic partners for vehicle servicing and integrated software
What first-quarter 2024 themes were reported for Zeekr?,Zeekr,chromadb-tfidf,Các chủ đề được báo cáo cho quý 1/2024 của Zeekr gồm: hiệu suất hoạt động và tài chính mạnh; ra mắt công ty đại chúng; ra mắt mẫu ZEEKR 001 2024 vào tháng 2 và bắt đầu giao xe từ tháng 3; đồng thời nhấn mạnh vị thế trong phân khúc xe điện trên 200.000 RMB tại Trung Quốc (3)(4).,"Các chủ đề nổi bật trong quý 1/2024 của Zeekr gồm: hiệu quả hoạt động và tài chính rất mạnh; giao xe quý 1 đạt 33.059 xe, tăng 117% so với cùng kỳ và lập kỷ lục quý; giữ vị thế thương hiệu bán chạy nhất trong phân khúc BEV trên 200.000 RMB tại Trung Quốc; doanh thu tăng 71,0%, lợi nhuận gộp tăng 154,9%; biên lợi nhuận xe tăng 3,9 điểm phần trăm nhờ kiểm soát chi phí mua sắm; đồng thời công ty nhấn mạnh các hướng đi tiếp theo như công nghệ thông minh/tự hành, hệ sinh thái sạc siêu nhanh và mở rộng dịch vụ kênh bán hàng (2)(4)(6)",7,9,False,False,"GraphRAG: GraphRAG đầy đủ và bám chứng cứ hơn: nêu rõ giao xe Q1, tăng trưởng doanh thu/lợi nhuận gộp, biên lợi nhuận xe, vị thế phân khúc >200.000 RMB và định hướng tiếp theo. FlatRAG đúng một phần nhưng bỏ sót nhiều ý quan trọng và thêm chi tiết IPO/ra mắt công ty đại chúng như một chủ đề Q1 dù xảy ra vào tháng 5/2024.","Zeekr -[REPORTED_Q1_2024_DELIVERIES]-> 33,059 vehicles in Q1 2024 | Zeekr -[REPORTED_TOTAL_REVENUE]-> RMB 14,736,752 thousand in Q1 2024 | Zeekr -[REPORTED_VEHICLE_SALES_REVENUE]-> RMB 8,174,117 thousand in Q1 2024 | Zeekr -[REPORTED_BATTERY_COMPONENT_REVENUE]-> RMB 6,318,535 thousand in Q1 2024"
What did Nikola report in first-quarter 2023 results?,Nikola,chromadb-tfidf,"Không đủ bằng chứng để xác định Nikola đã báo cáo gì trong kết quả quý 1 năm 2023, vì các nguồn được cung cấp không chứa thông tin về Nikola trong giai đoạn đó (1)(2)(3)(4)(5).","Nikola báo cáo trong kết quả quý I/2023 rằng họ đang tái ưu tiên hoạt động tập trung vào Bắc Mỹ, xe tải pin nhiên liệu hydro, mảng tiếp nhiên liệu hydro HYLA và công nghệ tự hành; sẽ bán phần sở hữu trong liên doanh sản xuất tại châu u cho Iveco để nhận 35 triệu USD tiền mặt và 20,6 triệu cổ phiếu Nikola; trong quý đã sản xuất 63 xe tải điện Tre và giao 31 xe cho đại lý, doanh số bán lẻ đạt 33 xe; đồng thời sẽ tạm dừng sản xuất tại Coolidge để nâng cấp dây chuyền, dự kiến nối lại vào tháng 7 với những xe tải hydro đầu tiên có thể bán được, bắt đầu sản xuất mô-đun/bộ pin vào cuối tháng 7 và lắp ráp Bosch Fuel Cell Power Module vào tháng 12/2023 (2)(3)(8)",2,9,False,False,"GraphRAG: FlatRAG bám sát bằng chứng nhưng trả lời thiếu vì bỏ sót nguồn liên quan trực tiếp đến Nikola. GraphRAG dùng đúng chứng cứ doc_20, tổng hợp được nhiều ý chính của báo cáo quý 1/2023 và suy luận đa bước tốt; chỉ hơi dài và có vài chi tiết thiên về kế hoạch tương lai nhưng vẫn được nguồn hỗ trợ.","Nikola -[HOSTS_WEBCAST_ON]-> May 9, 2023 | Nikola -[REPORTED_RESULTS_FOR]-> Q1 2023 | Nikola -[DELIVERED_TO_DEALERS]-> 31 Tre battery electric trucks in Q1 2023 | Nikola -[PLANS_PRODUCTION_PAUSE]-> truck production pause at end of May 2023"
"What investment level did U.S. EV investments reach, and what does that imply for the sector?","United States, public and private sector investment, energy sector investments, utilities sector, troubled real-estate sector",chromadb-tfidf,Không đủ bằng chứng để xác định mức đầu tư EV tại Mỹ đã đạt tới bao nhiêu và điều đó hàm ý gì cho lĩnh vực này; các đoạn được cung cấp không nêu con số hay kết luận trực tiếp về ý nghĩa đối với ngành (1)(2)(3)(4)(5),"Không đủ bằng chứng để xác định mức đầu tư của Mỹ vào EV đã đạt tới mức nào và điều đó hàm ý gì cho ngành. Tài liệu cung cấp chủ yếu nêu về đầu tư/trợ cấp của Trung Quốc cho EV (ví dụ hơn 230 tỷ USD trợ cấp từ 2009–2023) và chỉ nói chung rằng tại Mỹ, đầu tư tư nhân vào hạ tầng sạc là quan trọng, nhưng không nêu một con số tổng mức đầu tư EV của Mỹ hay kết luận trực tiếp về hàm ý đối với toàn ngành EV Mỹ (1)(2)(6).",6,7,False,False,"GraphRAG: Cả hai đều trả lời rằng không đủ bằng chứng, phù hợp với ngữ liệu. Tuy nhiên, GraphRAG dùng chứng cứ sát chủ đề EV hơn và giải thích rõ rằng số liệu nổi bật là của Trung Quốc chứ không phải Mỹ; dù có suy diễn nhẹ về hàm ý cho ngành, mức độ vẫn an toàn. FlatRAG cũng an toàn nhưng chứng cứ phần lớn lạc đề và hỗ trợ yếu.",National Zero-Emission Freight Corridor Strategy -[ALIGNS]-> public and private sector investment | energy sector investments -[PRIMARILY_DIRECTED_TOWARD]-> traditional oil and natural gas companies | China consumer confidence -[DRAGGED_BY]-> troubled real-estate sector | wind and solar -[MAY_BE_REPRESENTED_IN]-> utilities sector
How are Chinese battery companies investing in Europe and the United States?,"United States, China, Europe, Chinese battery company investment in the United States, United States tariffs on Chinese EVs, Chinese battery companies, more than 60,000 publicly accessible charging stations in the United States in 2024",chromadb-tfidf,"Các công ty pin Trung Quốc đang đầu tư ra nước ngoài nhanh hơn các hãng xe điện, đặc biệt vào châu u và Mỹ. Ở châu u, đây là điểm đến lớn nhất: nhiều hãng đang đầu tư hoặc lên kế hoạch đầu tư tại nhiều nước; ví dụ CATL có một nhà máy ở Đức và đang xây thêm một nhà máy ở Hungary. Mức mở rộng này thậm chí đã thúc đẩy tăng trưởng đầu tư greenfield từ Trung Quốc vào châu u năm 2022. Tại Mỹ, sau khi Đạo luật IRA được thông qua, nước này cũng trở thành điểm đến mới, nổi bật với hợp tác CATL-Ford và kế hoạch nhà máy của Gotion tại Michigan. (1)(2)","Các công ty pin Trung Quốc đang đầu tư vào châu u chủ yếu thông qua đầu tư nhà máy và dự án mới, với châu u là điểm đến lớn nhất; ví dụ CATL sở hữu một nhà máy ở Đức và đang xây thêm một nhà máy ở Hungary. Mức mở rộng này lớn đến mức trở thành động lực tăng trưởng của đầu tư greenfield từ Trung Quốc vào châu u năm 2022 (1)(2)(7). Ở Hoa Kỳ, đầu tư tăng lên sau khi Đạo luật Giảm Lạm phát (IRA) được thông qua, tiêu biểu là hợp tác CATL-Ford và nhà máy Gotion dự kiến xây ở Michigan (1)(2)(3). Ngoài ra, một số hãng pin như CATL và BYD còn tăng đầu tư theo hướng tích hợp dọc để bảo đảm nguồn khoáng sản quan trọng, nhất là lithium, ở ngoài Trung Quốc (2).",10,7,False,True,"FlatRAG: FlatRAG bám rất sát chứng cứ: đầu tư nhà máy ở châu u, châu u là điểm đến lớn nhất, và vào Mỹ sau IRA với CATL-Ford và Gotion Michigan. GraphRAG cũng đúng phần châu u và Mỹ, nhưng thêm ý BYD/CATL đầu tư tích hợp dọc để bảo đảm khoáng sản ngoài Trung Quốc; chứng cứ chỉ nói xu hướng đầu tư khoáng sản nói chung, không gắn riêng với châu u và Mỹ, nên có suy diễn thừa so với câu hỏi.",Inflation Reduction Act -[SUPPORTED_BY_POLICY]-> Chinese battery company investment in the United States | Chinese battery companies -[DROVE_GROWTH_IN]-> China greenfield investment into Europe in 2022 | Chinese EV companies -[EXPANDS_MANUFACTURING_TO]-> Europe | Chinese companies -[EXPANDS_TO]-> Europe
What does the EPA say about battery manufacturing emissions versus lifetime EV emissions?,EPA,chromadb-tfidf,"EPA cho biết phát thải từ sản xuất pin là một phần của phát thải chế tạo EV (thanh màu xanh), và tổng phát thải từ khâu sản xuất + cuối vòng đời của EV có thể cao hơn xe xăng. Tuy vậy, xét toàn bộ vòng đời, EV vẫn có tổng phát thải khí nhà kính thấp hơn xe xăng nhờ không có phát thải ống xả và thường phát thải ít hơn khi vận hành. EPA cũng lưu ý các ước tính còn phụ thuộc vào cỡ pin, hóa học pin, tuổi thọ xe và lưới điện sạc (2)(3).","Theo EPA, việc sản xuất EV — đặc biệt là pin — có thể tạo ra nhiều phát thải carbon hơn so với sản xuất xe xăng do cần thêm năng lượng để chế tạo pin. Tuy vậy, nếu tính trên toàn bộ vòng đời xe, tổng phát thải khí nhà kính của EV (gồm sản xuất, sạc và vận hành) thường vẫn thấp hơn xe chạy xăng, dù phát thải từ khâu sản xuất và cuối vòng đời của EV có thể cao hơn. EPA cũng lưu ý các ước tính thay đổi tùy loại pin, tuổi thọ xe và lưới điện dùng để sạc. (1)(3)(5)(7)",8,9,False,False,"GraphRAG: Cả hai câu trả lời đều đúng theo EPA: phát thải sản xuất pin làm tăng phát thải chế tạo EV, nhưng tổng phát thải vòng đời của EV thường vẫn thấp hơn xe xăng. FlatRAG dùng chứng cứ đúng nhưng có chỗ diễn đạt hơi lệch khi nói thanh xanh là toàn bộ phát thải chế tạo EV; thực ra EPA nói thanh xanh chỉ là phần pin, còn thanh cam là phần chế tạo còn lại và cuối vòng đời. GraphRAG bám sát chứng cứ EPA hơn, nối tốt quan hệ giữa phát thải sản xuất pin, phát thải vận hành và tổng vòng đời, nên nhỉnh hơn.",EPA -[PROVIDES]-> Beyond Tailpipe Emissions Calculator | EPA -[COLLABORATES_WITH]-> Department of Energy | Department of Energy -[PROVIDES]-> Beyond Tailpipe Emissions Calculator | Department of Energy -[OPERATES]-> Build a Better Grid Initiative
How does the Bipartisan Infrastructure Law address EV charging concerns?,Bipartisan Infrastructure Law,chromadb-tfidf,"Luật Cơ sở hạ tầng Lưỡng đảng giải quyết lo ngại về sạc EV bằng các sáng kiến của chính phủ nhằm mở rộng mạnh quyền tiếp cận trạm sạc, gồm đầu tư tối đa 7,5 tỷ USD để xây dựng mạng lưới sạc xe điện quốc gia dọc các tuyến cao tốc, cũng như trong cộng đồng và khu dân cư. Điều này được kỳ vọng sẽ làm tăng đáng kể khả năng tiếp cận sạc trong những năm tới và giảm bớt lo ngại về sạc của người dùng (2).","Luật Cơ sở hạ tầng Lưỡng đảng giải quyết lo ngại về sạc xe điện bằng cách tăng mạnh khả năng tiếp cận trạm sạc: đầu tư tới 7,5 tỷ USD để xây dựng mạng lưới sạc xe điện quốc gia dọc các tuyến cao tốc, trong cộng đồng và khu dân cư, qua đó giúp việc sạc thuận tiện hơn, kể cả trong tương lai gần (1)(2)(5). Ngoài ra, luật này cũng hỗ trợ nâng cấp lưới điện thông qua sáng kiến Build a Better Grid với hơn 13 tỷ USD để cải thiện độ tin cậy và hiệu quả của lưới điện, góp phần xử lý lo ngại về tác động của EV lên hệ thống điện (3)(4)(6).",9,8,False,False,"FlatRAG: Cả hai câu trả lời đều bám sát bằng chứng về khoản 7,5 tỷ USD để mở rộng mạng lưới sạc EV. FlatRAG trả lời trực tiếp đúng trọng tâm câu hỏi. GraphRAG thêm ý về nâng cấp lưới điện và Build a Better Grid, có căn cứ trong bằng chứng nhưng hơi mở rộng sang lo ngại tác động EV lên lưới điện, không phải trọng tâm chính của “charging concerns”, nên kém chính xác hơn một chút.",Bipartisan Infrastructure Law -[INVESTS_IN]-> Up to $7.5 billion national EV charging network | Build a Better Grid Initiative -[LAUNCHED_AS_PART_OF]-> Bipartisan Infrastructure Law | Build a Better Grid Initiative -[PROVIDES_FUNDING]-> Over $13 billion for grid reliability and efficiency over the next decade | Department of Energy -[OPERATES]-> Build a Better Grid Initiative
What does Goldman Sachs say about why EV sales are slowing?,EV sales,chromadb-tfidf,"Không đủ bằng chứng để nói Goldman Sachs cho rằng doanh số EV chậm lại là vì sao, vì các nguồn cung cấp không chứa nhận định nào từ Goldman Sachs; chỉ có dữ liệu Pew cho thấy người Mỹ ít hứng thú hơn với EV và thiếu tin tưởng vào hạ tầng sạc (3)(4), cùng dự báo của Cox rằng doanh số EV vẫn tăng trong năm 2024 (5).","Bằng chứng được cung cấp không nêu Goldman Sachs nói gì về lý do doanh số EV chậm lại. Chỉ có thông tin rằng các đại lý bi quan về doanh số EV tương lai, dù ưu đãi thuế/chính phủ được xem là có tác động tích cực; các yếu tố kìm hãm hiệu quả đại lý gồm điều kiện kinh tế, lãi suất cao và bất ổn chính trị (4), cùng với kỳ vọng doanh số EV sẽ giảm trong các tháng tới (1)(2)(3).",8,6,False,True,"FlatRAG: FlatRAG bám sát câu hỏi và nêu đúng rằng không có bằng chứng nào cho thấy Goldman Sachs giải thích nguyên nhân doanh số EV chậm lại. Dù có suy luận thêm từ Pew/Cox, câu trả lời vẫn không gán sai cho Goldman Sachs. GraphRAG cũng nhận ra thiếu bằng chứng trực tiếp, nhưng lại đưa ra các lý do từ tâm lý đại lý và điều kiện kinh tế như thể gần với câu hỏi, trong khi không hề chứng minh đó là nhận định của Goldman Sachs, nên rủi ro gán ghép/hallucination cao hơn.",Inflation Reduction Act incentives -[SUPPORTED_BY_POLICY]-> EV sales | Existing tax credits -[HAS_POSITIVE_IMPACT_ON]-> EV sales | EV sales -[GREW_BY]-> 15% in 2019 vs 2018 | Existing EV tax credits -[HAS_POSITIVE_IMPACT_ON]-> EV sales
How do dealer sentiment reports describe uncertainty in the EV and auto market?,Dealer sentiment,chromadb-tfidf,"Các báo cáo cho thấy đại lý nhìn chung mô tả thị trường ô tô là yếu và bị bao trùm bởi bất định. Trong Q2/2024, CADSI giữ ổn định nhưng vẫn nhấn mạnh sự không chắc chắn của thị trường và nền kinh tế; điểm thị trường hiện tại 42 cho thấy đa số đại lý xem thị trường là yếu (1)(2). Sang Q3/2024, tâm lý tiếp tục xấu đi: đại lý vẫn đánh giá thị trường yếu, bị kìm hãm bởi điều kiện kinh tế, lãi suất cao và bất định chính trị; doanh số xe ở mức 43 và tâm lý với EV chỉ nhích nhẹ nhưng vẫn thấp hơn năm trước (3)(4). Một báo cáo còn nêu rõ rằng trong ngành ô tô, bất định là “kẻ thù” vì làm giảm doanh số, làm xấu tâm lý người tiêu dùng và khiến đại lý lo ngại, dù vẫn có vài tín hiệu tích cực như tín dụng thuế EV hiệu quả hơn và lợi nhuận ổn định hơn (5)(2).","Các báo cáo tâm lý đại lý mô tả sự bất định của thị trường ô tô/EV là rất lớn: lãi suất, mùa bầu cử và khí hậu chính trị khiến người tiêu dùng lẫn đại lý “không chắc con đường phía trước”, tạo ra sự thận trọng và thậm chí “tê liệt” trên thị trường; trong ngành ô tô, bất định bị xem là “kẻ thù” vì làm giảm doanh số, xấu đi tâm lý người tiêu dùng và khiến đại lý lo ngại. Dù vậy, báo cáo cũng lưu ý tâm lý đại lý có thể bi quan hơn điều kiện thực tế, và một tín hiệu tiến triển đáng chú ý là hiệu quả của các khoản tín dụng thuế EV (1)(2)(4)(5)(7)",8,9,False,False,"GraphRAG: Cả hai câu trả lời đều bám sát bằng chứng và trả lời đúng ý về bất định trong thị trường ô tô/EV. FlatRAG đúng nhưng hơi dàn trải và có một vài chi tiết Q3/EV không trực tiếp làm rõ bản chất của “uncertainty”. GraphRAG mạnh hơn vì tổng hợp đa bước tốt hơn: nối lãi suất, mùa bầu cử/khí hậu chính trị, tác động tới người tiêu dùng và đại lý, rồi kết luận rằng bất định gây thận trọng/paralysis và làm xấu doanh số, tâm lý. Không thấy bịa đặt rõ ràng ở cả hai.",Election Outcome Expectations -[HURTS]-> Dealer sentiment | Election Outcome Expectations -[CAUSED_BY]-> Market Paralysis
